{
  "schema_version": "1.0.0",
  "catalog_version": "1.0.0",
  "generated_from": "official-documentation-review",
  "_boundary": {
    "ownership": "operator-owned-external-reference-only",
    "execution": "never-executed-by-workflow",
    "installation_owner": "operator/runtime",
    "managed_by_aiw": false,
    "lifecycle": "transitional-technical-debt",
    "deprecation_note": "Transitional technical debt: installer records predate the Declare-Verify-Consume-Execute boundary. The workflow never executes these commands (manual-only reference; read-only version probes only). Delete this catalog once O4 planning/verification migrates to runtime-prerequisites declarations."
  },
  "records": [
    {
      "installer_id": "INS-OPENCODE-NATIVE-SCRIPT",
      "adapter_id": "opencode",
      "display_name": "OpenCode official install script",
      "platform": "linux",
      "architecture": "any",
      "shell": "bash",
      "channel": "native-script",
      "command": {
        "display": "curl -fsSL https://opencode.ai/install | bash",
        "argv": ["curl", "-fsSL", "https://opencode.ai/install", "|", "bash"],
        "network": true,
        "pipe_to_shell": true,
        "elevated": false,
        "mutates_host": true,
        "execution_status": "manual-only"
      },
      "requirements": {"minimum_os": "Linux with Bash and curl", "required_tools": ["curl", "bash"], "internet_required": true},
      "provenance": {"official_url": "https://opencode.ai/docs/", "source_kind": "official-documentation", "retrieved_at": "2026-08-18", "source_fingerprint": "sha256:946f2cb2b4902fd275ec220cf416090e5fcb417f4d874573cb95453917d0d611", "command_location": "Install section: curl -fsSL https://opencode.ai/install | bash"},
      "review": {"status": "source-reviewed", "reviewed_at": "2026-08-18", "reviewer": "Manus AI", "notes": "Official channel; network-fetched shell pipeline. Manual-only under O4 policy."},
      "verification": {"version_argv": ["opencode", "--version"], "doctor_argv": [], "read_only": true, "timeout_seconds": 5, "version_output_required": true},
      "rollback": {"owner": "runtime-vendor", "supported": false, "guidance_url": "https://opencode.ai/docs/", "target_project_impact": 0}
    },
    {
      "installer_id": "INS-OPENCODE-NPM",
      "adapter_id": "opencode",
      "display_name": "OpenCode npm package",
      "platform": "linux",
      "architecture": "any",
      "shell": "any",
      "channel": "npm",
      "command": {
        "display": "npm install -g opencode-ai",
        "argv": ["npm", "install", "-g", "opencode-ai"],
        "network": true,
        "pipe_to_shell": false,
        "elevated": false,
        "mutates_host": true,
        "execution_status": "manual-only"
      },
      "requirements": {"minimum_os": "Linux, macOS, or Windows with Node.js", "required_tools": ["npm", "node"], "internet_required": true},
      "provenance": {"official_url": "https://opencode.ai/docs/", "source_kind": "official-documentation", "retrieved_at": "2026-08-18", "source_fingerprint": "sha256:61a36176b3681e85b67d6fdb9f57aed4314bd85e769c3a84498bc833c775b9bd", "command_location": "Install section: npm install -g opencode-ai"},
      "review": {"status": "source-reviewed", "reviewed_at": "2026-08-18", "reviewer": "Manus AI", "notes": "Official package channel; global package mutation remains user-controlled."},
      "verification": {"version_argv": ["opencode", "--version"], "doctor_argv": [], "read_only": true, "timeout_seconds": 5, "version_output_required": true},
      "rollback": {"owner": "package-manager", "supported": false, "guidance_url": "https://opencode.ai/docs/", "target_project_impact": 0}
    },
    {
      "installer_id": "INS-CLAUDE-NATIVE-SCRIPT",
      "adapter_id": "claude-code",
      "display_name": "Claude Code native install script",
      "platform": "linux",
      "architecture": "any",
      "shell": "bash",
      "channel": "native-script",
      "command": {
        "display": "curl -fsSL https://claude.ai/install.sh | bash",
        "argv": ["curl", "-fsSL", "https://claude.ai/install.sh", "|", "bash"],
        "network": true,
        "pipe_to_shell": true,
        "elevated": false,
        "mutates_host": true,
        "execution_status": "manual-only"
      },
      "requirements": {"minimum_os": "Ubuntu 20.04+ or Debian 10+ with Bash and curl", "required_tools": ["curl", "bash", "ripgrep"], "internet_required": true},
      "provenance": {"official_url": "https://code.claude.com/docs/en/setup", "source_kind": "official-documentation", "retrieved_at": "2026-08-18", "source_fingerprint": "sha256:310685317cefbbe8f47c35dd4644e0fef08acd2ff0dc4a16f7982c0481ced730", "command_location": "Install Claude Code: curl -fsSL https://claude.ai/install.sh | bash"},
      "review": {"status": "source-reviewed", "reviewed_at": "2026-08-18", "reviewer": "Manus AI", "notes": "Official native installer; native auto-update and provider authentication remain runtime-owned."},
      "verification": {"version_argv": ["claude", "--version"], "doctor_argv": ["claude", "doctor"], "read_only": true, "timeout_seconds": 10, "version_output_required": true},
      "rollback": {"owner": "runtime-vendor", "supported": false, "guidance_url": "https://code.claude.com/docs/en/setup", "target_project_impact": 0}
    },
    {
      "installer_id": "INS-CLAUDE-WINDOWS-POWERSHELL",
      "adapter_id": "claude-code",
      "display_name": "Claude Code Windows PowerShell installer",
      "platform": "windows",
      "architecture": "any",
      "shell": "powershell",
      "channel": "native-script",
      "command": {
        "display": "irm https://claude.ai/install.ps1 | iex",
        "argv": ["irm", "https://claude.ai/install.ps1", "|", "iex"],
        "network": true,
        "pipe_to_shell": true,
        "elevated": false,
        "mutates_host": true,
        "execution_status": "manual-only"
      },
      "requirements": {"minimum_os": "Windows 10 1809+ or Windows Server 2019+ with PowerShell", "required_tools": ["PowerShell"], "internet_required": true},
      "provenance": {"official_url": "https://code.claude.com/docs/en/setup", "source_kind": "official-documentation", "retrieved_at": "2026-08-18", "source_fingerprint": "sha256:43709a0a8827af44123d825f9db66d6438a1459a999bc4bb84d5295aa58f2181", "command_location": "Native Install (Recommended), Windows PowerShell"},
      "review": {"status": "source-reviewed", "reviewed_at": "2026-08-18", "reviewer": "Manus AI", "notes": "Official Windows command; expression execution is blocked by O4 policy."},
      "verification": {"version_argv": ["claude", "--version"], "doctor_argv": ["claude", "doctor"], "read_only": true, "timeout_seconds": 10, "version_output_required": true},
      "rollback": {"owner": "runtime-vendor", "supported": false, "guidance_url": "https://code.claude.com/docs/en/setup", "target_project_impact": 0}
    },
    {
      "installer_id": "INS-CLAUDE-NPM",
      "adapter_id": "claude-code",
      "display_name": "Claude Code npm package",
      "platform": "linux",
      "architecture": "any",
      "shell": "any",
      "channel": "npm",
      "command": {
        "display": "npm install -g @anthropic-ai/claude-code",
        "argv": ["npm", "install", "-g", "@anthropic-ai/claude-code"],
        "network": true,
        "pipe_to_shell": false,
        "elevated": false,
        "mutates_host": true,
        "execution_status": "manual-only"
      },
      "requirements": {"minimum_os": "Linux, macOS, or Windows with Node.js", "required_tools": ["npm", "node"], "internet_required": true},
      "provenance": {"official_url": "https://code.claude.com/docs/en/setup", "source_kind": "official-documentation", "retrieved_at": "2026-08-18", "source_fingerprint": "sha256:b551dd3a641a211d1a3099d81553ffd83b3ef95fc3731cabf74f890c70d0f9d0", "command_location": "Install with npm: npm install -g @anthropic-ai/claude-code"},
      "review": {"status": "source-reviewed", "reviewed_at": "2026-08-18", "reviewer": "Manus AI", "notes": "Official package channel; global package mutation remains user-controlled."},
      "verification": {"version_argv": ["claude", "--version"], "doctor_argv": ["claude", "doctor"], "read_only": true, "timeout_seconds": 10, "version_output_required": true},
      "rollback": {"owner": "package-manager", "supported": false, "guidance_url": "https://code.claude.com/docs/en/setup", "target_project_impact": 0}
    },
    {
      "installer_id": "INS-CODEX-NATIVE-SCRIPT",
      "adapter_id": "codex",
      "display_name": "Codex CLI standalone installer",
      "platform": "linux",
      "architecture": "any",
      "shell": "bash",
      "channel": "native-script",
      "command": {
        "display": "curl -fsSL https://chatgpt.com/codex/install.sh | sh",
        "argv": ["curl", "-fsSL", "https://chatgpt.com/codex/install.sh", "|", "sh"],
        "network": true,
        "pipe_to_shell": true,
        "elevated": false,
        "mutates_host": true,
        "execution_status": "manual-only"
      },
      "requirements": {"minimum_os": "macOS or Linux with Bash-compatible shell and curl", "required_tools": ["curl", "sh"], "internet_required": true},
      "provenance": {"official_url": "https://learn.chatgpt.com/docs/codex/cli", "source_kind": "official-documentation", "retrieved_at": "2026-08-18", "source_fingerprint": "sha256:d652183c244c7853c9269d2d4675b29e1b0db1dc75315eba9886165a2b3a8b36", "command_location": "Quickstart > Install Codex > macOS/Linux"},
      "review": {"status": "source-reviewed", "reviewed_at": "2026-08-18", "reviewer": "Manus AI", "notes": "Official standalone installer; first-run sign-in and permissions remain runtime-owned."},
      "verification": {"version_argv": ["codex", "--version"], "doctor_argv": [], "read_only": true, "timeout_seconds": 10, "version_output_required": true},